{
  "$schema": "https://json-schema.org/draft/2020-12/schema",
  "title": "OpenPhenology boundaries/1",
  "description": "County outlines for a state's map, as a GeoJSON FeatureCollection. For display only.",
  "type": "object",
  "required": [
    "id",
    "kind",
    "format",
    "provenance",
    "data"
  ],
  "properties": {
    "id": {
      "type": "string",
      "pattern": "^releases/\\d{4}-\\d{2}-\\d{2}/places/[a-z]{2}-[a-z0-9]{1,3}/boundaries(/\\d+)?\\.json$"
    },
    "kind": {
      "const": "boundaries"
    },
    "format": {
      "type": "string",
      "pattern": "^boundaries/1\\.\\d+$"
    },
    "provenance": {
      "type": "object",
      "required": [
        "release",
        "sources",
        "licences",
        "gbif_download_dois",
        "method",
        "taxonomy",
        "boundaries",
        "ranges",
        "protection",
        "code",
        "run"
      ],
      "properties": {
        "release": {
          "type": "string",
          "pattern": "^\\d{4}-\\d{2}-\\d{2}$"
        },
        "sources": {
          "type": "array",
          "items": {
            "type": "string"
          }
        },
        "licences": {
          "type": "array",
          "items": {
            "type": "string"
          }
        },
        "gbif_download_dois": {
          "type": "array",
          "items": {
            "type": "string"
          }
        },
        "method": {
          "anyOf": [
            {
              "type": "string"
            },
            {
              "type": "null"
            }
          ]
        },
        "taxonomy": {
          "anyOf": [
            {
              "type": "string"
            },
            {
              "type": "null"
            }
          ]
        },
        "boundaries": {
          "anyOf": [
            {
              "type": "string"
            },
            {
              "type": "null"
            }
          ]
        },
        "ranges": {
          "anyOf": [
            {
              "type": "array",
              "items": {
                "type": "string"
              }
            },
            {
              "type": "null"
            }
          ]
        },
        "protection": {
          "anyOf": [
            {
              "type": "object",
              "additionalProperties": {
                "type": "string"
              }
            },
            {
              "type": "null"
            }
          ]
        },
        "code": {
          "anyOf": [
            {
              "type": "string"
            },
            {
              "type": "null"
            }
          ]
        },
        "run": {
          "anyOf": [
            {
              "type": "string"
            },
            {
              "type": "null"
            }
          ]
        }
      }
    },
    "data": {
      "type": "object",
      "required": [
        "type",
        "features"
      ],
      "properties": {
        "type": {
          "const": "FeatureCollection"
        },
        "features": {
          "type": "array",
          "items": {
            "type": "object",
            "required": [
              "type",
              "properties",
              "geometry"
            ],
            "properties": {
              "type": {
                "const": "Feature"
              },
              "properties": {
                "type": "object",
                "required": [
                  "area",
                  "name",
                  "slug"
                ],
                "properties": {
                  "area": {
                    "type": "string",
                    "pattern": "^\\d{5}$"
                  },
                  "name": {
                    "type": "string",
                    "minLength": 1
                  },
                  "slug": {
                    "type": "string",
                    "pattern": "^[a-z0-9]+(-[a-z0-9]+)*$"
                  }
                }
              },
              "geometry": {
                "type": "object",
                "required": [
                  "type",
                  "coordinates"
                ],
                "properties": {
                  "type": {
                    "const": "MultiPolygon"
                  },
                  "coordinates": {
                    "type": "array",
                    "items": {
                      "type": "array",
                      "items": {
                        "type": "array",
                        "items": {
                          "type": "array",
                          "prefixItems": [
                            {
                              "type": "number",
                              "minimum": -180,
                              "maximum": 180
                            },
                            {
                              "type": "number",
                              "minimum": -90,
                              "maximum": 90
                            }
                          ],
                          "items": false,
                          "minItems": 2
                        },
                        "minItems": 4
                      },
                      "minItems": 1
                    },
                    "minItems": 1
                  }
                }
              }
            }
          }
        }
      }
    }
  }
}
