{
  "id": "releases/2026-01-05/places/us-zz/boundaries.json",
  "kind": "boundaries",
  "format": "boundaries/1.0",
  "provenance": {
    "release": "2026-01-05",
    "sources": ["example"],
    "licences": ["CC-BY-4.0"],
    "gbif_download_dois": ["10.0000/example"],
    "method": "test-1",
    "taxonomy": "test-taxonomy",
    "boundaries": "test-boundaries",
    "ranges": null,
    "protection": null,
    "code": "0.0.0",
    "run": "run-1"
  },
  "data": {
    "type": "FeatureCollection",
    "features": [
      {
        "type": "Feature",
        "properties": {
          "area": "99001",
          "name": "Example",
          "slug": "example"
        },
        "geometry": {
          "type": "MultiPolygon",
          "coordinates": [
            [
              [
                [0, 0],
                [1, 0],
                [0, 1],
                [0, 0]
              ]
            ]
          ]
        }
      }
    ]
  }
}
